title,description,link
Drone Attacks Hit Russia for 2nd Straight Day As Ukraine Strikes More Boldly,The third apparent drone attack in two days on a Russian air base indicates a new phase of the war for Ukraine as it develops longer-range weapons.,https://www.nytimes.com/2022/12/06/world/europe/ukraine-drone-strikes-russian-bases.html
NATO Commits To Future Ukraine Membership, Drums Up Aid,U.S. Secretary of State Antony Blinken will announce substantial U.S. aid for Ukraine’s energy grid.,https://www.huffpost.com/entry/nato-meets-ukraine-blinken_n_6385d086e4b0e4c7759663f6
Russian Oil Cap Begins, Trying To Pressure Putin Over Ukraine War,The European Union, along with Australia, Britain, Canada, Japan and the United States agreed to the measure on Friday.,https://www.huffpost.com/entry/russian-oil-price-cap-ukraine-war_n_638dbc93e4b07530543bcd23
Russia-Ukraine war live: Blinken says US did not ‘enable’ Ukraine strikes inside Russia,<p>US secretary of state says it ‘neither encouraged nor enabled’ drone strikes deep inside Russia that damaged long-range bombers</p><ul><li><a href='https://www.theguardian.com/world/2022/dec/07/russia-ukraine-war-at-a-glance-what-we-know-on-day-287-of-the-invasion'>What we know on day 287 of the invasion</a></li></ul><p>More now on Europe’s energy crisis, via AFP:</p><p><strong>Sky-high energy prices have caused numerous factories, particularly in Germany’s chemicals sector, which was highly dependent upon cheap Russian gas, to halt operations. But European nations were able to fill their gas reservoirs and no one has been cut off yet.</strong></p> <a href='https://www.theguardian.com/world/live/2022/dec/07/russia-ukraine-war-live-blinken-says-us-did-not-enable-ukraine-strikes-inside-russia'>Continue reading...</a>,https://www.theguardian.com/world/live/2022/dec/07/russia-ukraine-war-live-blinken-says-us-did-not-enable-ukraine-strikes-inside-russia
Russian TV station in Latvia loses licence over Ukraine war coverage,<p>TV Rain had relocated from Russia soon after invasion but on-air remarks by presenter were deemed to take Moscow’s side</p><ul><li><a href='https://www.theguardian.com/world/live/2022/dec/06/russia-ukraine-war-live-drone-attack-hits-kursk-airfield-in-russia-says-governor-further-strikes-in-zaporizhzhia-region'>Russia-Ukraine war – latest news updates</a></li></ul><p>Latvia has revoked a broadcast licence for TV Rain, the independent Russian TV station broadcasting from exile, following a scandal over its coverage of the war in Ukraine.</p><p>The liberal television station relocated to Riga, the Latvian capital, as well as Tbilisi and Amsterdam shortly after Vladimir Putin launched the full-scale invasion of Ukraine.</p> <a href='https://www.theguardian.com/world/2022/dec/06/rain-russian-tv-station-in-latvia-loses-licence-over-ukraine-war-coverage'>Continue reading...</a>,https://www.theguardian.com/world/2022/dec/06/rain-russian-tv-station-in-latvia-loses-licence-over-ukraine-war-coverage

